name_tejary,mavared_masraf,avarez_janebi,amozesh,tavajohat
Milk Of Magnesia, عنوان آنتی اسید ملین استفاده قرار میگیرد بیمار بستری های بیمارستان کاهش تحرک نرفتن یبوست دارو مفید ,اسهال مشکلات قلب اختلالات نوار قلب EEG 1 ," دارو همراه مایعات استفاده مصرف, شیشه دارو تکان داد#ده ",توصیه لیوان آب دارو میل مصرف دراز وابستگی ایجاد 
Catapres," کنترل فشار خون همراه بیمار های کلیوی درمان محرومیت مواد مخدر کودک فعال توجه, سردرد های میگرن",خشکی دهان تهوع استفراغ یبوست نارسایی قلب عصبانیت قرار کهیر نازک مو نا توانی جنس خارش عود فشار خون, مصرف همزمان آنتی هیستامین خوددار نوبت دارو خواب استفاده ,معاینه چشم مرتب انجام ارو تدریج قطع فشار خون بیمار مرتب چک 
Dobutrex,درمان نارسایی حاد قلب شوک قلب عفونی جراح قلب افزایش ضرب قلب,"حملات آسم کاهش فشار خون حساسیت شدید, تهوع سردرد تپش قلب تنگ نفس"," صورت تشدید علائم پزشک اطلاع داد#ده محل تزریق درد ایجاد شود, صورت پرستار اطلاع داد#ده ",مایعات بیمار تامین نوار قلب فشار خون بیمار کنترل 
Decadrol,"التهاب دهان دارو مخصوص تست تشخیص بیمار های غده کلیه ورم مغز استفراغ التهاب مفاصل, درمان کمک مننژیت باکتریال ورم مجاری هوا",زخم دستگاه گوارش بیخوابی احساس انرژی سرخوشی تشنج,بتامتازون خوراک همراه غذا شیر استفاده ,قطع دارو استروئیدی تدریج هفته صورت 
Proscar,درمان هیپرپلازی خوش خیم پروستات BPH آلوپسی طاس مردانه درمان هیرسوتیسم زن,"کاهش میل جنس ضایعات جلدی, تورم پستان ....", بیمار دارو قطع ریزش مو مردانه سال آغاز ," درمان رشدخوش خیم پروستات سال وقت بیمار BPH, تست های پروستات بدخیم انجام وضعیت کلیه سنگ انسداد مطالعه "
Buspar,,سردرد سرگیجه تهوع خشکی دهان اسهال,دارو همراه غذا مصرف قطع ناگهانی دارو ضد اضطراب اجتناب راننگی کار ظریف پرهیز ,علائم بهبود 7 10 روز آشکار نتایج 4 هفته ظاهر 
SpoRANOX,عفونت قارچ آسپرژیلوس بلاستومایکوزیس هیستوپلاسموزیس عفونت های کاندیدا مننژیت کرپیتوکوکی کرات قارچ,دل درد اسهال سردرد رفتن فشار خون بزرگ پستان کچلی موضع تورم اندام ها,دارو لیوان آب میل صورت حساسیت دارو قطع پزشک اطلاع داد#ده صورت مصرف دارو های قلبیمثل دیگوکسین پزشک اطلاع داد#ده رنگ ادرار مدفوع پزشک اطلاع داد#ده ,تست های کبد ارزیاب کشت قارچ اسمیر مطمئن شد#شو 
Dostinex,بیمار افزایش ترشح پرولاکتین بیمار پارکینسون, قرار افسردگی کاهش فشار خون تهوع یبوست اسهال درد پستان سرگیجه خوابید#خواب,مصرف دارو 6 ماه طبیعی سطح هورمون پرولاکتین ادامه همراه دارو مصرف ایندرال قرص ضد حاملگی مجاز ,میزان دارو اندازه پرولاکتین سرید#سر ارزیاب کاهش فشار خون جزء موارد مد گرفت#گیر 
Buprenex,تسکین درد های شدید بیهوشی کنترل برگرداندن مهار تنفس فنتانیل بیهوشی,سرگیجه سردرد کاهش فشار خون تهوع تعریق رفتن فشار خون,احتمال سرگیجه فیزیو تراپی قفسه سینه انجام تنفس عمیق سرفه ها صورت استفاده بیهوشی عمل بیمار ضروری ,احتمال محال سیستم تنفس 
Miochol, عمل جراح عدس چشم کاتاراکت آب مروارید ,آتروفی عنبیه چشم کدورت عدس چشم اختلال دید کاهش فشار خون شایع عارضا اشکال تنفس تعریق,سوزش چشم سر درد جزء عوارض همراه بیمار خاطر نشان صورت گر گرفتگی تعریق پزشک اطلاع داد#ده , دارو نا پایدار بنابر کادر درمانی دانست#دان مابقی دارو درو ریخت#ریز 
Alphagan,آب سیاه چشم کاهش فشار چشم گلوکوم ,سرگیجه خشکی دهان تار دید پرخور سرفه, خستگی سرگیجه رانندگی کار دقیق اجتناب ,فشار داخل چشم مصرف منظم کنترل 
Vinuphos,افزاش بیدار هشیار تسریع کارکرد عضلات افزایش عملکرد سیستم تنفس همراه ضد درد آسپیرین کدئین مصرف ,تعوع سر درد خوابید#خواب تشنج وزوزگوش توهم بینایی افزایش ناراحت گوارش ,مصرف آ « خطرناک , ضورت علائم مسمومیت شستشو معده تخلیه مفید 
Apomorphin Hcl,ایجاد استفراغ مسمومیت دارویی, قرار لرزش دست خواب آلودگی تهوع نارسایی قلب حاد مشکل تنفس,بیمار تزریق 200 300 میلی لیتر آب نوشید#نوش بیمار وضعیت قرار گرفت#گیر احتمال آسیپیراسیون مواد استفراغ داخل ریه داشت#دار ,استفراغ ظرف 5 دقیقه تزریق ایجاد علائم حیاتی بیمار 2 ساعت تزریق کنترل 
Bellergal,پیسگیری سردرد های میگرن مشکلات هیجان سردرد قاعدگی کاهش علائم یائسگی,تار دید خشکی دهان علائم عصبی مشکلات اداری ,دارو نیم ساعت غذا شب موقع خواب مصرف صورت تار دید خواب آلودگی راننگی اجتناب مایعات نوشید#نوش ,پزشک سابقه بیمار های کلیوی کبد چشم رسید#رس فاصه تجویز آنتی اسید دارو ساعت بیمار آنتی اسید غذا مصرف 
Ergomar,درمان سردرد های عروق میگرن ,تهوع استفراغ خول آلودگی ضعف عموم ضعف شدید درد شکم پارسنتری تشنج,مصرف سرانه میزان بالا دارو ممنوع دارو جویده بلعیده صورت شعف عموم سردی انگ پزشک اطلاع داد#ده استعمال همزمان سیگار خطرناک عفونت احتمال پزشک اطلاع داد#ده , صورت تهوع شدید متوکلوپرامید خوراک تزریق استفاده 
Colgout,درمان نقرس درمان آ میلوئیدوز آرتریت بهجت سیروز کبد,"تهوع استفراغ عوارض پوست کهیر درماتیت درد شکم اسهال پایین آمدن فشار خون گیجید#گیج ریزش مو, تکرر ادرار",دارو شیر غذا مصرف صورت استفراغ ساهال شدید مشکل تنفس کاهش ادرار علائم مسمومیت پزشک مراجعه ,آژمایشهای کلیوی خون کنترل الزام بهبود علائم دارو قطع 
DtIC,سرطان های خون سرطان پوست ملانوم بدخیم ,عوارض خون اسهال زخم دهان استفراغ اشتهایی خون,بیمار بایست پزشک پیگیری آزمایش همکار تار دید اختلال حس نشانه مسمومیت , داور طریق ورید استفاده شمارش سلول های خون منظم انجام ارجح بیمار ابتدا درمان بیمارستان بستری 
Endoxan,درمان سرطان های لنفوم اوسمی سرطان تخمدان پستان بیمار نارسایی کلیه سندرم نفروتیک رماتیسم بیمار بافت همبند,تهوع استفراغ خون ادرار عوارض خون خونریزی اختلال الکترولیت های خون عوارض قلب اسهال, صورت خونریزی ادرار مدفوع دهان پوست پزشک اطلاع داد#ده اسهال همراه درد شکم متناوب تهوع ضعف عموم نشانگر کمبود پتاسیم پزشک اطلاع داد#ده ,قرص معده خال مصرف آزمایش های خون انجام 
Leukeran,"درمان سرطان های لوسمی لنفوم هوچکین هوچکین ,به جانبی درمان روماتوئید آرتریت سندرم بهجت استفاده میشود ",کاهش سلول های خون اختلالات خون خون عوارض ریوی سرفه مشکلات گوارش زخم دهان,بیمار 2 هفته معاینه قرار گرفت#گیر زن سن باردار جلوگیری استفاده دارو شدت حاملگی خطرناک توام اختلالات جنین ,بررسی آزمایش خون حین درمان ضروری احتمال عفونت خونریزی برا بیمار گوشزد خانم ها عملکرد تخمدان دوره ماهانه مختل 
Mustargen,لنفوم لنفوسارکوم سرطان ریه سرطان ها CML CLL,تهوع استفراغ تمایل خونریزی سرگیجه خواب آلودگی اشتهایی, دستور متوالی پزشک مراجعه صورت خونریزی خونمردگی پزشک اطلاع داد#ده کچلی دارو برگ پذیر مسواک زدن دقت مسواک نرم استعمال سیگار نوشید#نوش الکل خطرناک , تزریق دستکش ماسک استفاده 
Bicnu, درمان سرطان های مغز ساقه مغز لنفوم مولتیپل میلوما, ایجاد ترومبوسیتوپنی کاهش سلول های پلاکت خون لوسمی حاد اسهال اشتهایی ترومبوز ایجاد لخته رگ ها , تزریق محل تزریق یخ قرار داد#ده حین درمان برافروختگی رخ زود رود ریزش مو احتمال عفونت ویروس بیمار تذکر داد#ده ,تست های کبد کلیوی خون حین درمان انجام بیمار دلیل عوارض شدید دارو مستقیم پزشک احنمال خونریزی بیمار گوشزد 
Ceenu,سرطان های مغز لنفوم هوچکین,"عوارض خون شدید کاهش گلوبول سفید خون جمله اند, عوارض کلیوی اختلالات حرکت قراری, عوارض گوارش تهوع استفراغ زخم دهان کچلی",اعضا خانواده بیمار واکسیناسیون ویروس زنده قرار گرفت#گیر تهوع استفراغ میتوان مصرف دارو غذا کاهش خانم ها دارو قطع عادت ماهیانه , سرکوب ایمن استعداد آلودگی میکروبی افزایش کنترل آزمایش خون ضروری فعالیت غدد جنس حین دارو کاهش میابد 
Myleran,درمان کنترل مهار سرطان CML لوسمی میلوبلاستیک مزمن ,خونریزی سردرد افسردگی تار دید وزوز گوش عوارض تنفس پستان ها مرد یبوست استفراغ اسهال بیضه ها فیبروز ریه آب مروارید چشم ,دارو روز ساعات معین مصرف معده خال مصرف بیمار احتمال خونریزی مسواک نخ دندان مراقب ,آزمایش های خون کبد کلیوی کنترل ریه ها معاینه بالین انجام واکسن حتما اطلاع پزشک 
Paraplatin,سرطان تخمدان سرطان ریه سرطلن های رحم لوسمی تومور بیضه,تهوع استفراغ کاهش فعالیت مغز استخوان خون عوارض شدید کلیوی همراه دارو جنتامایسین استفاده , کبود خونریزی بینی پزشک اطلاع داد#ده اختلالات حس بینایی پزشک اطلاع داد#ده مراقب بود#باش درمان ضربه آسیب فیزیکی بدن شد#شو ,تجویز توسط پزشک تجربه زمینه درمان سرطان انکولوژیست صورت آزمایش های خون کلیوی حین درمان انجام عفونت گلودرد حین درمان تلقی احتمال خونریزی لثه مجاری ادرار 
Platinol,درمان کمک سزطان ها بیضه ریه مثانه تومور های تخمدان,تهوع استفراغ عوارض خون تمایل خونریزی مشکلات گوارش,بیمار انجام معاینات دوره ای پیگیر بیمار خانواده زندگی میکنند واکسن زنده ویروس فلج اطفال سرخک زد#زن درد پهلو سوزن مشکلات ادرار پزشک اطلاع داد#ده ,تست های کلیوی حین درمان انجام احتمال اختلالات شنوایی فشار خون مشکلات قلب شد#شو 
Cetavlon,ضد عفونی زخم های سوختگی تمیز پوست التهاب پوست شستشو حین جراح کیست هیداتید, صورت استفاده موضع غلظت پوست تحریک تهوع استفراغ مهار فعالیت مغز کاهش فشار خون مشکل تنفس ایجا , تماس محلول مخاط بدن دهان زبان حفره بینی شدیدا اجتناب ,واکنش حساسیت غلظت های 
Pronestyl, نظم های ریتم قلب AF-PAC-PVST-VT-MI کاربرد ,"تب درد عضلانی نظم قلبی, اختلالات روانی, بلوک قلبی, ضعف سرگیجه اشتهایی, تهوع درد شکم",درد عضلانی اسهال درد گلو پزشک مراجعه صورت تب ضایعات پوست اطلاع داد#ده ,اختلالات خون عوارض شایع صورت خونریزی رنگ پوست خونمردگی آزمایش انعقاد انجام صورت تزریق ورید بایست بیمار کنترل 
Ditropan,درد تحریک مثانه شب ادرار اختیار ادرار,تب سردرد تار دید تهوع یبوست سرگیجه افزایش ضرب قلب میدریاز مردمک چشم کاهش میل جنس مرد, صورت علائم خواب آلودگی اختلال هوشیار پزشک اطلاع داد#ده خشکی دهان عوارض شایع آدامس آب نبات استفاده ,تشنج تحریک پذیرفت#پذیر علائم مسمومیت 
symmetrel, درمان علامت آنفولانزا ویروس تیپ A درمان عوارض دارویی واکنش اکسترا پیرامیدال پارکینسون,افسردگی سرگیجه توهم کاهش فشار خون خشکی دهان عوارض خون, مصرف خواب آلودگی کار دقیق راننگی ممنوع خشکی دهان مایعات شستشو دهان استفاده ,میزان ادرار سلول های خون حین مصرف کنترل 
Amino,عارضه سو تغذیه مشکلات تغذیه ای کمبود پروتئین کالری,سرگیجه ادم ریه افزایش فشار خون راش پوست افزایش جبرانی قند خون تب, صورت تب علائم درد تورم محل تزریق پزشک اطلاع داد#ده ,پزشک معالج ویتامین k رژیم غذا بیمار اضافه هفته ای 10 میلی گرم علائم حیاتی بیمار توسط پرستار کنرل آزمایش های خون کبد کلیه قند بررسی 
Garamycin,عفونت های گرم منفی های استاف زخم جراح عفونت ادرار عفونت ناحیه لگن,"عوارض کلیوی خطرناک است, مشکلات شنوایی, ضعف عمومی, تشنج عوارض پوست خارش زخم دهان راش کهیر","دارو ها دستور پزشک مصرف عوارض اطلاع داد#ده موضع جنتامایسین ,بیمار معرض نور ", اختلال عملکرد کلیه میزان کاهش تنظیم اسهال خارش جلد گرفت#گیر 
Amikin,عفونت های خطرناک دستگاه اداری استخوان پرده مغز دستگاه تنفس,مشکل عضلانی مهار تنفس مشکلات شنوایی نارسایی کلیه, صورت سرگیجه اختلال شنوایی پزشک اطلاع داد#ده ,مشکل اختلال تنفس نمود#نما زمان تزریق محلول شفاف بیمار دوره درمانی حین کلیه شنوایی آزمایش 
Mycifradin,آمادگی عمل جراح کاهش میکروب های روده ای,تهوع مشکلات گوارش سوء جذب عوارض عضلانی, موضع آ « عوارض آلرژیک همراه صورت مشکلات گوارش پزشک اطلاع داد#ده , نارسایی کبد کلیوی احتیاط مصرف آزمایش کارکرد کلیه حتما کنترل 
Streptocol, تب مالت بیمار سل عنوان دارو کمک بروسلوزیس,حساسیت پوست عوارض کلیوی شنوایی تهوع استفراغ, اشکال شنوایی پزشک اطلاع داد#ده , کشت آنتی بیوگرام مطمئن شد#شو ضدمه شنوایی تعادل گوش مشکل آفرین 
Wellbutrin,افسردگی ترک سیگار,فشار خون پایین خارش تار دید خشکی دهان تب لرز سردرد ضعف اختلال شنوایی,قطع ناگهانی دارو خطرناک دارو ساعات معین مصرف راننگی خوددار ,احتمال تشنج افزایش میزان مصرف رود احتمال ناتوان جنس بیمار گوشزد 
Aralen,عفونت های مالاریا عفونت آمیب داخل خارج روده ای کنترل التهاب رماتیسم مفصل زخم روده التهاب مفصل آسم بیمار های التهاب ناشناخته پوست درماتومیوزیت لیکن پل اریتم دوخت#دوز,تهوع اسهال اختلال بینایی اضطراب خستگی ضعف عموم قرار افسردگی اشتهایی,بیمار حین درمان دراز تحد چشم پزشک بیمار مبتلا فاویسم احتیاط مصرف بیمار دوره درمان ,معاینه چشم بررسی عملکرد کلیه بیمارن درمان ضروری 
Neurontin, صرع پارشیل تشنج جنرالیزه عموم ,سردرد خواب آلودگی تهوع استفراغ گیجید#گیج درد عضلانی مشکلات چشم اختلال خلق سرفه تپش قلب, دارو آ « تی اسید مصرف فاصله نوبت دارو 12 ساعت ,عملکرد کلیه تست دارو ناگهانی قطع پزشک بایست نتیجه درمان بررسی 
Rocaltrol,درمان کمبود کلسیم بیمارانی درمان دیالیز قرار درمان هیپو پاراتیروئیدیسم بیمار ریکتز کمبود ویتامین D ,فشار خون خارش سردرد ضعف قرار تهوع سنگ کلیوی کاهش میل جنس خشکی دهان درد استخوان نظم قلب آریتمی , صورت علائم قلب مسمومیت پزشک اطلاع داد#ده دارو میتوان غذا غذا مصرف ,سطح سرمی کلسیم فسفر آلکالن فسفاتاز عملکرد کلیه درمان بررسی احتمال هیپر کلسمی 
Dovonex,ضد پسوریازیس,تحریک پوست صورت موضع افزایش کلسیم خون جذب 6 دارو صورت عموم,پماد ظایعه مالید#مال تماس چشم جلوگیری صورت 2 8 هفته بهبود نسبی حاصل شد#شو پزشک اطلاع داد#ده ,علائم بهبود 1 2 هفته ظاهر بیمار پسوریازیس شدید کاربرد 
Desferal Mesylate,مسمومیت آهن بیمار تالاسمی ماژور هموسیدروز مسمومیت آلومینیوم تشحیص افزایش آهن خون,تزریق سریع داخل ورید دارو واکنش حساسیت درد عضلانی شدید تزریق عضلانی مشاهده , رنگ ادرار تار دید اختلال بینایی گزارش داد#ده , خون کشنده نارسایی کلیه گزارش بنابر تست های انجام دفروکسامین هپارین ناسازگار 
Lagamet,زخم معده برگ مواد معده مری التهاب اختلال معده,سردرد اسهال سرگیجه کاهش میل جنس درد عضلانی بلوک قلب, رانندگی اجتناب زمان بهبود مصرف دارو ادامه داد#ده , دارو غذا مصرف آزمایش خون CBC حین درمان انجام 
Imuran, پیوند کلیه سرکوب مهار بیمار آرتریت روماتوئید,تهوع استفراغ مشکلات گلبول های خون آسیب کبد احتمال سرطان یرقان زرد عفونت, صورت ادرار تیره زرد پوست چشم خارش مدفوع روشن پزشک اطلاع داد#ده بیمار درمان صبور رماتیسم مفصل جواب درمان 3 4 ماه کشید#کش هرگونه تب اسهال خستگی شدید پزشک اطلاع داد#ده ,آزمایش های اولیه کلیوی کبد خون ضروری کارکرد کلیه ها میزان مایعات مصرف ادرار روزانه اندازه 
Dauno Xorne,سرطان های خون AML ALL ,عوارض خون قلب زخم دهان تهوع استفراغ زرد,حاملگی دوره مصرف دارو ممنوع ریزش مو برگ 2 3 ماه صورت کبود پزشک اطلاع داد#ده مایعات نوشید#نوش صورت تب همراه گلو درد پزشک اطلاع داد#ده ,بیمار مستعد خونریزی بیمار متذکر شد#شو اختلالات خون نمود#نما شمارش سلول های خون مرتب انجام داد#ده 
Anthranol,پسوریازیس مطمن حاد ضایعات تاول پوسچولی ,تحریک زود گذر پوست حساسیت دارویی, بیمار تذکر داد#ده دارو رنگ پوست مو , کمترین میزان دارو 
Difrarel - E,نارسایی ورید عروق لنفاوی هنگامی اختلالات عروق شکننده خونریزی نقطهای پتشی واکیموز خون مردگی ایجاد ,گزارش شد#شو,-----------, دارو شیر داد#ده مجاز 
Dopamet,فشار خون سندرم رینود,"خواب آلودگی اسهال درد قلبی, زرد درد عضله مفصل","خشکی دهان مصرف مایعات آدامس ضعف سرگیجه اسهال یبوست علائم مسمومیت اند, پزشک اطلاع داد#ده ",فشار خون بیمار کنترل آزمایش خون بررسی 
Diane,درمان آکنه پرمو طبیعی هیر سوتیسم ,احساس خستگی ضایعات جلد ترشح شیر پستان افسردگی, صورت علائم پزشک مراجعه , صورت زرد مشکلات پزشک مراجعه 
Clomid,درمان نازا نا رسا تخمدان موارد تشخیص عملکرد تخمدان کار رود ,تهوع استفراغ تار دید فشار عصبی خستگی ضایعات پوست ریزش مو درد شکم اسهال یبوست زرد حساسیت نور, صورت اثبات حاملگی دارو قطع درد شکم نشانه بزرگ کیست تخمدان تلقی پزشک اطلاع داد#ده ,پزشک بایست درمان تاریخچه پزشک سوابق بیمار بیمار مطالعه قرص روز پنجم قاعدگی 5 روز تجویز 
Almox,آنتی اسید درمان تحریک دستگاه گوارش زخم معده مصرف ,یبوست اسهال تهوع کاهش اشتها,یبوست جزء عوارض نا خواست#خواه ,مصرف دارو ضد انعقاد خوراک وافارین کاهش جذب دارو 
magel,درمان نفخ کاهش اسید معده,کاهش اشتها تهوع استفراغ, 2 4 ساعت غذا خواب استفاده , صورت تداوم خونریزی معده مشکل پزشک مراجعه 
Aerospooin, درمان عفونت چشم میکروب های مقاوم ملتحمه قرینیه چشم,تزریق دردناک سرگیجه ضایعات پوست مشکلات کلیوی عوارض عمده , صورت پزشک اطلاع داد#ده ,الزاما پزشک متخصص مصرف 
Augmentin,عفونت ریه عفونت گوش میان سینوزیت عفونت ها پوست کلیه مجاری ادرار,اسهال تشنج عوارض کلیوی ضایعات پوست تهوع استفراغ, آماده دارو شکل پودربه شربت 2 مرحله آّ اضافه پودر آب خانم ها علائم عفونت قارچ مجاری تناسلی واژن صورت ترشحات سفید پنیر , دارو ترکیب آموکسی سیلین کلاولانیک اسید اختلال عملکرد کلیوی احتیاط مصرف راش ضایعات جلد دیر نشانگر حساسیت 
